
*** Running vivado
    with args -log BConvEngine_8PE_V2.vds -m64 -product Vivado -mode batch -messageDb vivado.pb -notrace -source BConvEngine_8PE_V2.tcl


ECHO is off.
ECHO is off.

****** Vivado v2023.2_AR000036317 (64-bit)
  **** SW Build 4029153 on Fri Oct 13 20:14:34 MDT 2023
  **** IP Build 4028589 on Sat Oct 14 00:45:43 MDT 2023
  **** SharedData Build 4025554 on Tue Oct 10 17:18:54 MDT 2023
    ** Copyright 1986-2022 Xilinx, Inc. All Rights Reserved.
    ** Copyright 2022-2023 Advanced Micro Devices, Inc. All Rights Reserved.

source BConvEngine_8PE_V2.tcl -notrace
create_project: Time (s): cpu = 00:00:10 ; elapsed = 00:00:14 . Memory (MB): peak = 488.043 ; gain = 192.562
Command: read_checkpoint -auto_incremental -incremental D:/Projects/BConv/BConv.srcs/utils_1/imports/synth_1/delay.dcp
INFO: [Vivado 12-5825] Read reference checkpoint from D:/Projects/BConv/BConv.srcs/utils_1/imports/synth_1/delay.dcp for incremental synthesis
INFO: [Vivado 12-7989] Please ensure there are no constraint changes
Command: synth_design -top BConvEngine_8PE_V2 -part xcu280-fsvh2892-2L-e -mode out_of_context
Starting synth_design
Attempting to get a license for feature 'Synthesis' and/or device 'xcu280'
INFO: [Common 17-349] Got license for feature 'Synthesis' and/or device 'xcu280'
WARNING: [Vivado_Tcl 4-1809] The reference checkpoint is from an old version of Vivado; A full resynthesis flow will be run
INFO: [Device 21-403] Loading part xcu280-fsvh2892-2L-e
INFO: [Synth 8-7079] Multithreading enabled for synth_design using a maximum of 2 processes.
INFO: [Synth 8-7078] Launching helper process for spawning children vivado processes
INFO: [Synth 8-7075] Helper process launched with PID 21464
---------------------------------------------------------------------------------
Starting RTL Elaboration : Time (s): cpu = 00:00:11 ; elapsed = 00:00:14 . Memory (MB): peak = 2387.711 ; gain = 432.637
---------------------------------------------------------------------------------
INFO: [Synth 8-11241] undeclared symbol 'mm_valid', assumed default net type 'wire' [D:/Projects/BConv/BConv.srcs/sources_1/new/BConvEngine_8PE_V2.sv:215]
INFO: [Synth 8-11241] undeclared symbol 'mux_out_1_d', assumed default net type 'wire' [D:/Projects/BConv/BConv.srcs/sources_1/new/RBU_V2.v:209]
INFO: [Synth 8-6157] synthesizing module 'BConvEngine_8PE_V2' [D:/Projects/BConv/BConv.srcs/sources_1/new/BConvEngine_8PE_V2.sv:23]
INFO: [Synth 8-6157] synthesizing module 'register' [D:/Projects/BConv/BConv.srcs/sources_1/new/register.v:23]
	Parameter BW bound to: 48 - type: integer 
INFO: [Synth 8-6155] done synthesizing module 'register' (0#1) [D:/Projects/BConv/BConv.srcs/sources_1/new/register.v:23]
INFO: [Synth 8-6157] synthesizing module 'mux' [D:/Projects/BConv/BConv.srcs/sources_1/new/mux.v:23]
	Parameter BW bound to: 48 - type: integer 
INFO: [Synth 8-6155] done synthesizing module 'mux' (0#1) [D:/Projects/BConv/BConv.srcs/sources_1/new/mux.v:23]
INFO: [Synth 8-6157] synthesizing module 'delay' [D:/Projects/BConv/BConv.srcs/sources_1/new/delay.v:23]
	Parameter N bound to: 2 - type: integer 
	Parameter BW bound to: 48 - type: integer 
INFO: [Synth 8-6155] done synthesizing module 'delay' (0#1) [D:/Projects/BConv/BConv.srcs/sources_1/new/delay.v:23]
INFO: [Synth 8-6157] synthesizing module 'register__parameterized0' [D:/Projects/BConv/BConv.srcs/sources_1/new/register.v:23]
	Parameter BW bound to: 50 - type: integer 
INFO: [Synth 8-6155] done synthesizing module 'register__parameterized0' (0#1) [D:/Projects/BConv/BConv.srcs/sources_1/new/register.v:23]
INFO: [Synth 8-6157] synthesizing module 'delay__parameterized0' [D:/Projects/BConv/BConv.srcs/sources_1/new/delay.v:23]
	Parameter N bound to: 2 - type: integer 
	Parameter BW bound to: 50 - type: integer 
INFO: [Synth 8-6155] done synthesizing module 'delay__parameterized0' (0#1) [D:/Projects/BConv/BConv.srcs/sources_1/new/delay.v:23]
INFO: [Synth 8-6157] synthesizing module 'mux__parameterized0' [D:/Projects/BConv/BConv.srcs/sources_1/new/mux.v:23]
	Parameter BW bound to: 50 - type: integer 
INFO: [Synth 8-6155] done synthesizing module 'mux__parameterized0' (0#1) [D:/Projects/BConv/BConv.srcs/sources_1/new/mux.v:23]
INFO: [Synth 8-6157] synthesizing module 'delay__parameterized1' [D:/Projects/BConv/BConv.srcs/sources_1/new/delay.v:23]
	Parameter N bound to: 4 - type: integer 
	Parameter BW bound to: 48 - type: integer 
INFO: [Synth 8-6155] done synthesizing module 'delay__parameterized1' (0#1) [D:/Projects/BConv/BConv.srcs/sources_1/new/delay.v:23]
INFO: [Synth 8-6157] synthesizing module 'delay__parameterized2' [D:/Projects/BConv/BConv.srcs/sources_1/new/delay.v:23]
	Parameter N bound to: 6 - type: integer 
	Parameter BW bound to: 48 - type: integer 
INFO: [Synth 8-6155] done synthesizing module 'delay__parameterized2' (0#1) [D:/Projects/BConv/BConv.srcs/sources_1/new/delay.v:23]
INFO: [Synth 8-6157] synthesizing module 'delay__parameterized3' [D:/Projects/BConv/BConv.srcs/sources_1/new/delay.v:23]
	Parameter N bound to: 8 - type: integer 
	Parameter BW bound to: 48 - type: integer 
INFO: [Synth 8-6155] done synthesizing module 'delay__parameterized3' (0#1) [D:/Projects/BConv/BConv.srcs/sources_1/new/delay.v:23]
INFO: [Synth 8-6157] synthesizing module 'delay__parameterized4' [D:/Projects/BConv/BConv.srcs/sources_1/new/delay.v:23]
	Parameter N bound to: 10 - type: integer 
	Parameter BW bound to: 48 - type: integer 
INFO: [Synth 8-6155] done synthesizing module 'delay__parameterized4' (0#1) [D:/Projects/BConv/BConv.srcs/sources_1/new/delay.v:23]
INFO: [Synth 8-6157] synthesizing module 'delay__parameterized5' [D:/Projects/BConv/BConv.srcs/sources_1/new/delay.v:23]
	Parameter N bound to: 12 - type: integer 
	Parameter BW bound to: 48 - type: integer 
INFO: [Synth 8-6155] done synthesizing module 'delay__parameterized5' (0#1) [D:/Projects/BConv/BConv.srcs/sources_1/new/delay.v:23]
INFO: [Synth 8-6157] synthesizing module 'delay__parameterized6' [D:/Projects/BConv/BConv.srcs/sources_1/new/delay.v:23]
	Parameter N bound to: 14 - type: integer 
	Parameter BW bound to: 48 - type: integer 
INFO: [Synth 8-6155] done synthesizing module 'delay__parameterized6' (0#1) [D:/Projects/BConv/BConv.srcs/sources_1/new/delay.v:23]
INFO: [Synth 8-6157] synthesizing module 'pipe' [D:/Projects/BConv/BConv.srcs/sources_1/new/pipe.v:23]
	Parameter cycle bound to: 12 - type: integer 
INFO: [Synth 8-6155] done synthesizing module 'pipe' (0#1) [D:/Projects/BConv/BConv.srcs/sources_1/new/pipe.v:23]
INFO: [Synth 8-6157] synthesizing module 'array_reg' [D:/Projects/BConv/BConv.srcs/sources_1/new/array_reg.sv:23]
	Parameter BW bound to: 48 - type: integer 
	Parameter N bound to: 8 - type: integer 
WARNING: [Synth 8-7186] Applying attribute ram_style = "distributed" is ignored, object 'storage[0]' is not inferred as ram due to incorrect usage [D:/Projects/BConv/BConv.srcs/sources_1/new/array_reg.sv:32]
WARNING: [Synth 8-7186] Applying attribute ram_style = "distributed" is ignored, object 'storage[1]' is not inferred as ram due to incorrect usage [D:/Projects/BConv/BConv.srcs/sources_1/new/array_reg.sv:32]
WARNING: [Synth 8-7186] Applying attribute ram_style = "distributed" is ignored, object 'storage[2]' is not inferred as ram due to incorrect usage [D:/Projects/BConv/BConv.srcs/sources_1/new/array_reg.sv:32]
WARNING: [Synth 8-7186] Applying attribute ram_style = "distributed" is ignored, object 'storage[3]' is not inferred as ram due to incorrect usage [D:/Projects/BConv/BConv.srcs/sources_1/new/array_reg.sv:32]
WARNING: [Synth 8-7186] Applying attribute ram_style = "distributed" is ignored, object 'storage[4]' is not inferred as ram due to incorrect usage [D:/Projects/BConv/BConv.srcs/sources_1/new/array_reg.sv:32]
WARNING: [Synth 8-7186] Applying attribute ram_style = "distributed" is ignored, object 'storage[5]' is not inferred as ram due to incorrect usage [D:/Projects/BConv/BConv.srcs/sources_1/new/array_reg.sv:32]
WARNING: [Synth 8-7186] Applying attribute ram_style = "distributed" is ignored, object 'storage[6]' is not inferred as ram due to incorrect usage [D:/Projects/BConv/BConv.srcs/sources_1/new/array_reg.sv:32]
WARNING: [Synth 8-7186] Applying attribute ram_style = "distributed" is ignored, object 'storage[7]' is not inferred as ram due to incorrect usage [D:/Projects/BConv/BConv.srcs/sources_1/new/array_reg.sv:32]
INFO: [Synth 8-6155] done synthesizing module 'array_reg' (0#1) [D:/Projects/BConv/BConv.srcs/sources_1/new/array_reg.sv:23]
INFO: [Synth 8-6157] synthesizing module 'RBUA' [D:/Projects/BConv/BConv.srcs/sources_1/new/RBUA.sv:23]
	Parameter BW bound to: 48 - type: integer 
	Parameter N bound to: 8 - type: integer 
INFO: [Synth 8-6157] synthesizing module 'RBU_V2' [D:/Projects/BConv/BConv.srcs/sources_1/new/RBU_V2.v:44]
	Parameter BW bound to: 48 - type: integer 
INFO: [Synth 8-6157] synthesizing module 'delay__parameterized7' [D:/Projects/BConv/BConv.srcs/sources_1/new/delay.v:23]
	Parameter N bound to: 13 - type: integer 
	Parameter BW bound to: 48 - type: integer 
INFO: [Synth 8-6155] done synthesizing module 'delay__parameterized7' (0#1) [D:/Projects/BConv/BConv.srcs/sources_1/new/delay.v:23]
INFO: [Synth 8-6157] synthesizing module 'delay__parameterized8' [D:/Projects/BConv/BConv.srcs/sources_1/new/delay.v:23]
	Parameter N bound to: 1 - type: integer 
	Parameter BW bound to: 50 - type: integer 
INFO: [Synth 8-6155] done synthesizing module 'delay__parameterized8' (0#1) [D:/Projects/BConv/BConv.srcs/sources_1/new/delay.v:23]
WARNING: [Synth 8-689] width (1) of port connection 'out' does not match port width (48) of module 'delay' [D:/Projects/BConv/BConv.srcs/sources_1/new/RBU_V2.v:209]
INFO: [Synth 8-6157] synthesizing module 'delay__parameterized9' [D:/Projects/BConv/BConv.srcs/sources_1/new/delay.v:23]
	Parameter N bound to: 1 - type: integer 
	Parameter BW bound to: 48 - type: integer 
INFO: [Synth 8-6155] done synthesizing module 'delay__parameterized9' (0#1) [D:/Projects/BConv/BConv.srcs/sources_1/new/delay.v:23]
INFO: [Synth 8-6157] synthesizing module 'delay__parameterized10' [D:/Projects/BConv/BConv.srcs/sources_1/new/delay.v:23]
	Parameter N bound to: 11 - type: integer 
	Parameter BW bound to: 48 - type: integer 
INFO: [Synth 8-6155] done synthesizing module 'delay__parameterized10' (0#1) [D:/Projects/BConv/BConv.srcs/sources_1/new/delay.v:23]
INFO: [Synth 8-6157] synthesizing module 'ModSub' [D:/Projects/BConv/BConv.srcs/sources_1/new/ModSub.v:23]
	Parameter BW bound to: 48 - type: integer 
INFO: [Synth 8-6155] done synthesizing module 'ModSub' (0#1) [D:/Projects/BConv/BConv.srcs/sources_1/new/ModSub.v:23]
INFO: [Synth 8-6157] synthesizing module 'ModAdd' [D:/Projects/BConv/BConv.srcs/sources_1/new/ModAdd.v:23]
	Parameter BW bound to: 48 - type: integer 
INFO: [Synth 8-6155] done synthesizing module 'ModAdd' (0#1) [D:/Projects/BConv/BConv.srcs/sources_1/new/ModAdd.v:23]
INFO: [Synth 8-6157] synthesizing module 'ModMul' [D:/Projects/BConv/BConv.srcs/sources_1/new/ModMul.v:24]
	Parameter BW bound to: 48 - type: integer 
INFO: [Synth 8-6157] synthesizing module 'dsp_mul' [D:/Projects/BConv/BConv.srcs/sources_1/new/dsp_mul.v:23]
	Parameter A_WIDTH bound to: 16 - type: integer 
	Parameter B_WIDTH bound to: 16 - type: integer 
	Parameter OUT_WIDTH bound to: 32 - type: integer 
INFO: [Synth 8-6155] done synthesizing module 'dsp_mul' (0#1) [D:/Projects/BConv/BConv.srcs/sources_1/new/dsp_mul.v:23]
INFO: [Synth 8-6157] synthesizing module 'dsp_mac' [D:/Projects/BConv/BConv.srcs/sources_1/new/dsp_mac.v:23]
	Parameter A_WIDTH bound to: 16 - type: integer 
	Parameter B_WIDTH bound to: 16 - type: integer 
	Parameter C_WIDTH bound to: 17 - type: integer 
	Parameter OUT_WIDTH bound to: 34 - type: integer 
INFO: [Synth 8-6155] done synthesizing module 'dsp_mac' (0#1) [D:/Projects/BConv/BConv.srcs/sources_1/new/dsp_mac.v:23]
INFO: [Synth 8-6157] synthesizing module 'pipeline' [D:/Projects/BConv/BConv.srcs/sources_1/new/pipeline.v:23]
	Parameter BW bound to: 32 - type: integer 
INFO: [Synth 8-6155] done synthesizing module 'pipeline' (0#1) [D:/Projects/BConv/BConv.srcs/sources_1/new/pipeline.v:23]
INFO: [Synth 8-6157] synthesizing module 'pipeline__parameterized0' [D:/Projects/BConv/BConv.srcs/sources_1/new/pipeline.v:23]
	Parameter BW bound to: 34 - type: integer 
INFO: [Synth 8-6155] done synthesizing module 'pipeline__parameterized0' (0#1) [D:/Projects/BConv/BConv.srcs/sources_1/new/pipeline.v:23]
INFO: [Synth 8-6157] synthesizing module 'delay__parameterized11' [D:/Projects/BConv/BConv.srcs/sources_1/new/delay.v:23]
	Parameter N bound to: 1 - type: integer 
	Parameter BW bound to: 51 - type: integer 
INFO: [Synth 8-6155] done synthesizing module 'delay__parameterized11' (0#1) [D:/Projects/BConv/BConv.srcs/sources_1/new/delay.v:23]
INFO: [Synth 8-6157] synthesizing module 'delay__parameterized12' [D:/Projects/BConv/BConv.srcs/sources_1/new/delay.v:23]
	Parameter N bound to: 3 - type: integer 
	Parameter BW bound to: 51 - type: integer 
INFO: [Synth 8-6155] done synthesizing module 'delay__parameterized12' (0#1) [D:/Projects/BConv/BConv.srcs/sources_1/new/delay.v:23]
INFO: [Synth 8-6157] synthesizing module 'dsp_mul__parameterized0' [D:/Projects/BConv/BConv.srcs/sources_1/new/dsp_mul.v:23]
	Parameter A_WIDTH bound to: 17 - type: integer 
	Parameter B_WIDTH bound to: 17 - type: integer 
	Parameter OUT_WIDTH bound to: 34 - type: integer 
INFO: [Synth 8-6155] done synthesizing module 'dsp_mul__parameterized0' (0#1) [D:/Projects/BConv/BConv.srcs/sources_1/new/dsp_mul.v:23]
INFO: [Synth 8-6157] synthesizing module 'dsp_preadder' [D:/Projects/BConv/BConv.srcs/sources_1/new/dsp_preadder.v:23]
	Parameter A_WIDTH bound to: 17 - type: integer 
	Parameter B_WIDTH bound to: 17 - type: integer 
	Parameter C_WIDTH bound to: 18 - type: integer 
	Parameter OUT_WIDTH bound to: 36 - type: integer 
INFO: [Synth 8-6157] synthesizing module 'dsp_mul__parameterized1' [D:/Projects/BConv/BConv.srcs/sources_1/new/dsp_mul.v:23]
	Parameter A_WIDTH bound to: 18 - type: integer 
	Parameter B_WIDTH bound to: 18 - type: integer 
	Parameter OUT_WIDTH bound to: 36 - type: integer 
INFO: [Synth 8-6155] done synthesizing module 'dsp_mul__parameterized1' (0#1) [D:/Projects/BConv/BConv.srcs/sources_1/new/dsp_mul.v:23]
INFO: [Synth 8-6155] done synthesizing module 'dsp_preadder' (0#1) [D:/Projects/BConv/BConv.srcs/sources_1/new/dsp_preadder.v:23]
INFO: [Synth 8-6157] synthesizing module 'delay__parameterized13' [D:/Projects/BConv/BConv.srcs/sources_1/new/delay.v:23]
	Parameter N bound to: 5 - type: integer 
	Parameter BW bound to: 48 - type: integer 
INFO: [Synth 8-6155] done synthesizing module 'delay__parameterized13' (0#1) [D:/Projects/BConv/BConv.srcs/sources_1/new/delay.v:23]
INFO: [Synth 8-6157] synthesizing module 'pipeline__parameterized1' [D:/Projects/BConv/BConv.srcs/sources_1/new/pipeline.v:23]
	Parameter BW bound to: 96 - type: integer 
INFO: [Synth 8-6155] done synthesizing module 'pipeline__parameterized1' (0#1) [D:/Projects/BConv/BConv.srcs/sources_1/new/pipeline.v:23]
INFO: [Synth 8-6157] synthesizing module 'delay__parameterized14' [D:/Projects/BConv/BConv.srcs/sources_1/new/delay.v:23]
	Parameter N bound to: 6 - type: integer 
	Parameter BW bound to: 96 - type: integer 
INFO: [Synth 8-6155] done synthesizing module 'delay__parameterized14' (0#1) [D:/Projects/BConv/BConv.srcs/sources_1/new/delay.v:23]
INFO: [Synth 8-6157] synthesizing module 'pipeline__parameterized2' [D:/Projects/BConv/BConv.srcs/sources_1/new/pipeline.v:23]
	Parameter BW bound to: 50 - type: integer 
INFO: [Synth 8-6155] done synthesizing module 'pipeline__parameterized2' (0#1) [D:/Projects/BConv/BConv.srcs/sources_1/new/pipeline.v:23]
INFO: [Synth 8-6155] done synthesizing module 'ModMul' (0#1) [D:/Projects/BConv/BConv.srcs/sources_1/new/ModMul.v:24]
INFO: [Synth 8-6157] synthesizing module 'DIV2' [D:/Projects/BConv/BConv.srcs/sources_1/new/DIV2.v:23]
	Parameter BW bound to: 48 - type: integer 
INFO: [Synth 8-6155] done synthesizing module 'DIV2' (0#1) [D:/Projects/BConv/BConv.srcs/sources_1/new/DIV2.v:23]
INFO: [Synth 8-6155] done synthesizing module 'RBU_V2' (0#1) [D:/Projects/BConv/BConv.srcs/sources_1/new/RBU_V2.v:44]
INFO: [Synth 8-6155] done synthesizing module 'RBUA' (0#1) [D:/Projects/BConv/BConv.srcs/sources_1/new/RBUA.sv:23]
INFO: [Synth 8-6155] done synthesizing module 'BConvEngine_8PE_V2' (0#1) [D:/Projects/BConv/BConv.srcs/sources_1/new/BConvEngine_8PE_V2.sv:23]
WARNING: [Synth 8-7129] Port replay_restart in module BConvEngine_8PE_V2 is either unconnected or has no load
---------------------------------------------------------------------------------
Finished RTL Elaboration : Time (s): cpu = 00:00:13 ; elapsed = 00:00:17 . Memory (MB): peak = 2506.340 ; gain = 551.266
---------------------------------------------------------------------------------
---------------------------------------------------------------------------------
Start Handling Custom Attributes
---------------------------------------------------------------------------------
---------------------------------------------------------------------------------
Finished Handling Custom Attributes : Time (s): cpu = 00:00:13 ; elapsed = 00:00:17 . Memory (MB): peak = 2506.340 ; gain = 551.266
---------------------------------------------------------------------------------
---------------------------------------------------------------------------------
Finished RTL Optimization Phase 1 : Time (s): cpu = 00:00:13 ; elapsed = 00:00:17 . Memory (MB): peak = 2506.340 ; gain = 551.266
---------------------------------------------------------------------------------
Netlist sorting complete. Time (s): cpu = 00:00:01 ; elapsed = 00:00:01 . Memory (MB): peak = 2506.340 ; gain = 0.000
INFO: [Project 1-570] Preparing netlist for logic optimization

Processing XDC Constraints
Initializing timing engine
Parsing XDC File [D:/Projects/BConv/BConv.srcs/constrs_1/new/timing.xdc]
create_clock: Time (s): cpu = 00:00:08 ; elapsed = 00:00:08 . Memory (MB): peak = 2670.855 ; gain = 17.137
Finished Parsing XDC File [D:/Projects/BConv/BConv.srcs/constrs_1/new/timing.xdc]
Completed Processing XDC Constraints

Netlist sorting complete. Time (s): cpu = 00:00:00 ; elapsed = 00:00:00.015 . Memory (MB): peak = 2670.855 ; gain = 0.000
INFO: [Project 1-111] Unisim Transformation Summary:
No Unisim elements were transformed.

The system cannot find the path specified.
Constraint Validation Runtime : Time (s): cpu = 00:00:02 ; elapsed = 00:00:01 . Memory (MB): peak = 2745.852 ; gain = 74.996
---------------------------------------------------------------------------------
Finished Constraint Validation : Time (s): cpu = 00:00:49 ; elapsed = 00:00:54 . Memory (MB): peak = 2745.852 ; gain = 790.777
---------------------------------------------------------------------------------
---------------------------------------------------------------------------------
Start Loading Part and Timing Information
---------------------------------------------------------------------------------
Loading part: xcu280-fsvh2892-2L-e
INFO: [Synth 8-6742] Reading net delay rules and data
---------------------------------------------------------------------------------
Finished Loading Part and Timing Information : Time (s): cpu = 00:00:49 ; elapsed = 00:00:54 . Memory (MB): peak = 2745.852 ; gain = 790.777
---------------------------------------------------------------------------------
---------------------------------------------------------------------------------
Start Applying 'set_property' XDC Constraints
---------------------------------------------------------------------------------
---------------------------------------------------------------------------------
Finished applying 'set_property' XDC Constraints : Time (s): cpu = 00:00:49 ; elapsed = 00:00:54 . Memory (MB): peak = 2745.852 ; gain = 790.777
---------------------------------------------------------------------------------
WARNING: [Synth 8-327] inferring latch for variable 'mux_lat_sel_reg[4]' [D:/Projects/BConv/BConv.srcs/sources_1/new/RBU_V2.v:93]
WARNING: [Synth 8-327] inferring latch for variable 'mux_lat_sel_reg[2]' [D:/Projects/BConv/BConv.srcs/sources_1/new/RBU_V2.v:93]
WARNING: [Synth 8-327] inferring latch for variable 'mux_lat_sel_reg[1]' [D:/Projects/BConv/BConv.srcs/sources_1/new/RBU_V2.v:93]
WARNING: [Synth 8-327] inferring latch for variable 'mux_lat_sel_mu_reg' [D:/Projects/BConv/BConv.srcs/sources_1/new/RBU_V2.v:98]
---------------------------------------------------------------------------------
Finished RTL Optimization Phase 2 : Time (s): cpu = 00:00:50 ; elapsed = 00:00:55 . Memory (MB): peak = 2745.852 ; gain = 790.777
---------------------------------------------------------------------------------
---------------------------------------------------------------------------------
Start RTL Component Statistics 
---------------------------------------------------------------------------------
Detailed RTL Component Info : 
+---Adders : 
	   5 Input   96 Bit       Adders := 8     
	   3 Input   84 Bit       Adders := 8     
	   5 Input   50 Bit       Adders := 8     
	   4 Input   49 Bit       Adders := 8     
	   2 Input   49 Bit       Adders := 8     
	   3 Input   48 Bit       Adders := 32    
	   4 Input   48 Bit       Adders := 8     
	   2 Input   48 Bit       Adders := 32    
	   5 Input   37 Bit       Adders := 8     
	   4 Input   37 Bit       Adders := 16    
	   5 Input   35 Bit       Adders := 16    
	   4 Input   35 Bit       Adders := 32    
	   2 Input   18 Bit       Adders := 48    
	   2 Input   17 Bit       Adders := 96    
+---Registers : 
	               96 Bit    Registers := 56    
	               51 Bit    Registers := 40    
	               50 Bit    Registers := 55    
	               48 Bit    Registers := 751   
	               36 Bit    Registers := 24    
	               34 Bit    Registers := 48    
	               32 Bit    Registers := 64    
	               12 Bit    Registers := 1     
	                1 Bit    Registers := 16    
+---Muxes : 
	   2 Input   50 Bit        Muxes := 16    
	   2 Input   48 Bit        Muxes := 152   
	   2 Input   35 Bit        Muxes := 24    
	   2 Input   12 Bit        Muxes := 1     
	   8 Input    1 Bit        Muxes := 88    
	   2 Input    1 Bit        Muxes := 2     
---------------------------------------------------------------------------------
Finished RTL Component Statistics 
---------------------------------------------------------------------------------
---------------------------------------------------------------------------------
Start Part Resource Summary
---------------------------------------------------------------------------------
Part Resources:
DSPs: 9024 (col length:94)
BRAMs: 4032 (col length: RAMB18 288 RAMB36 144)
---------------------------------------------------------------------------------
Finished Part Resource Summary
---------------------------------------------------------------------------------
---------------------------------------------------------------------------------
Start Cross Boundary and Area Optimization
---------------------------------------------------------------------------------
WARNING: [Synth 8-7080] Parallel synthesis criteria is not met
DSP Report: Generating DSP out_reg, operation Mode is: (A*B)'.
DSP Report: register out_reg is absorbed into DSP out_reg.
DSP Report: operator out0 is absorbed into DSP out_reg.
DSP Report: Generating DSP out_reg, operation Mode is: (A*B)'.
DSP Report: register out_reg is absorbed into DSP out_reg.
DSP Report: operator out0 is absorbed into DSP out_reg.
DSP Report: Generating DSP out_reg, operation Mode is: (A*B)'.
DSP Report: register out_reg is absorbed into DSP out_reg.
DSP Report: operator out0 is absorbed into DSP out_reg.
DSP Report: Generating DSP out_reg, operation Mode is: (A*B)'.
DSP Report: register out_reg is absorbed into DSP out_reg.
DSP Report: operator out0 is absorbed into DSP out_reg.
DSP Report: Generating DSP out_reg, operation Mode is: (A*B)'.
DSP Report: register out_reg is absorbed into DSP out_reg.
DSP Report: operator out0 is absorbed into DSP out_reg.
DSP Report: Generating DSP out_reg, operation Mode is: (A*B)'.
DSP Report: register out_reg is absorbed into DSP out_reg.
DSP Report: operator out0 is absorbed into DSP out_reg.
DSP Report: Generating DSP out_reg, operation Mode is: (C+A*B)'.
DSP Report: register out_reg is absorbed into DSP out_reg.
DSP Report: operator out0 is absorbed into DSP out_reg.
DSP Report: operator out0 is absorbed into DSP out_reg.
DSP Report: Generating DSP out_reg, operation Mode is: (C+A*B)'.
DSP Report: register out_reg is absorbed into DSP out_reg.
DSP Report: operator out0 is absorbed into DSP out_reg.
DSP Report: operator out0 is absorbed into DSP out_reg.
DSP Report: Generating DSP out_reg, operation Mode is: (C+A*B)'.
DSP Report: register out_reg is absorbed into DSP out_reg.
DSP Report: operator out0 is absorbed into DSP out_reg.
DSP Report: operator out0 is absorbed into DSP out_reg.
DSP Report: Generating DSP out_reg, operation Mode is: (A*B)'.
DSP Report: register out_reg is absorbed into DSP out_reg.
DSP Report: operator out0 is absorbed into DSP out_reg.
DSP Report: Generating DSP out_reg, operation Mode is: (A*B)'.
DSP Report: register out_reg is absorbed into DSP out_reg.
DSP Report: operator out0 is absorbed into DSP out_reg.
DSP Report: Generating DSP out_reg, operation Mode is: (A*B)'.
DSP Report: register out_reg is absorbed into DSP out_reg.
DSP Report: operator out0 is absorbed into DSP out_reg.
WARNING: [Synth 8-3936] Found unconnected internal register 'delay_z/buffer_reg[5]' and it is trimmed from '96' to '50' bits. [D:/Projects/BConv/BConv.srcs/sources_1/new/delay.v:36]
WARNING: [Synth 8-3936] Found unconnected internal register 'delay_z/buffer_reg[4]' and it is trimmed from '96' to '50' bits. [D:/Projects/BConv/BConv.srcs/sources_1/new/delay.v:36]
WARNING: [Synth 8-3936] Found unconnected internal register 'delay_z/buffer_reg[3]' and it is trimmed from '96' to '50' bits. [D:/Projects/BConv/BConv.srcs/sources_1/new/delay.v:36]
WARNING: [Synth 8-3936] Found unconnected internal register 'delay_z/buffer_reg[2]' and it is trimmed from '96' to '50' bits. [D:/Projects/BConv/BConv.srcs/sources_1/new/delay.v:36]
WARNING: [Synth 8-3936] Found unconnected internal register 'delay_z/buffer_reg[1]' and it is trimmed from '96' to '50' bits. [D:/Projects/BConv/BConv.srcs/sources_1/new/delay.v:36]
WARNING: [Synth 8-3936] Found unconnected internal register 'delay_z/buffer_reg[0]' and it is trimmed from '96' to '50' bits. [D:/Projects/BConv/BConv.srcs/sources_1/new/delay.v:36]
DSP Report: Generating DSP pipe_z1/out_reg, operation Mode is: ((D+A)*B)'.
DSP Report: register pipe_z1/out_reg is absorbed into DSP pipe_z1/out_reg.
DSP Report: register mul_z1/out_reg is absorbed into DSP pipe_z1/out_reg.
DSP Report: operator mul_z1/product is absorbed into DSP pipe_z1/out_reg.
DSP Report: operator B0B1 is absorbed into DSP pipe_z1/out_reg.
DSP Report: Generating DSP pipe_z5/out_reg, operation Mode is: ((D+A)*B)'.
DSP Report: register pipe_z5/out_reg is absorbed into DSP pipe_z5/out_reg.
DSP Report: register mul_z5/out_reg is absorbed into DSP pipe_z5/out_reg.
DSP Report: operator mul_z5/product is absorbed into DSP pipe_z5/out_reg.
DSP Report: operator B0B2 is absorbed into DSP pipe_z5/out_reg.
DSP Report: Generating DSP pipe_z3/out_reg, operation Mode is: ((D+A)*B)'.
DSP Report: register pipe_z3/out_reg is absorbed into DSP pipe_z3/out_reg.
DSP Report: register mul_z3/out_reg is absorbed into DSP pipe_z3/out_reg.
DSP Report: operator mul_z3/product is absorbed into DSP pipe_z3/out_reg.
DSP Report: operator B1B2 is absorbed into DSP pipe_z3/out_reg.
DSP Report: Generating DSP pipe_w5/out_reg, operation Mode is: ((D'+A'')*B)'.
DSP Report: register pipe_w5/out_reg is absorbed into DSP pipe_w5/out_reg.
DSP Report: register delay_q/buffer_reg[3] is absorbed into DSP pipe_w5/out_reg.
DSP Report: register delay_q/buffer_reg[4] is absorbed into DSP pipe_w5/out_reg.
DSP Report: register pipe_w5/out_reg is absorbed into DSP pipe_w5/out_reg.
DSP Report: register mul_y5/out_reg is absorbed into DSP pipe_w5/out_reg.
DSP Report: operator mul_y5/product is absorbed into DSP pipe_w5/out_reg.
DSP Report: operator q0q2 is absorbed into DSP pipe_w5/out_reg.
DSP Report: Generating DSP pipe_w3/out_reg, operation Mode is: ((D'+A'')*B)'.
DSP Report: register pipe_w3/out_reg is absorbed into DSP pipe_w3/out_reg.
DSP Report: register pipe_w3/out_reg is absorbed into DSP pipe_w3/out_reg.
DSP Report: register pipe_w3/out_reg is absorbed into DSP pipe_w3/out_reg.
DSP Report: register pipe_w3/out_reg is absorbed into DSP pipe_w3/out_reg.
DSP Report: register mul_y3/out_reg is absorbed into DSP pipe_w3/out_reg.
DSP Report: operator mul_y3/product is absorbed into DSP pipe_w3/out_reg.
DSP Report: operator q1q2 is absorbed into DSP pipe_w3/out_reg.
DSP Report: Generating DSP pipe_w1/out_reg, operation Mode is: ((D'+A'')*B)'.
DSP Report: register delay_q/buffer_reg[4] is absorbed into DSP pipe_w1/out_reg.
DSP Report: register pipe_w1/out_reg is absorbed into DSP pipe_w1/out_reg.
DSP Report: register pipe_w1/out_reg is absorbed into DSP pipe_w1/out_reg.
DSP Report: register pipe_w1/out_reg is absorbed into DSP pipe_w1/out_reg.
DSP Report: register mul_y1/out_reg is absorbed into DSP pipe_w1/out_reg.
DSP Report: operator mul_y1/product is absorbed into DSP pipe_w1/out_reg.
DSP Report: operator q0q1 is absorbed into DSP pipe_w1/out_reg.
WARNING: [Synth 8-3936] Found unconnected internal register 'A1_delay_1/buffer_reg[1]' and it is trimmed from '48' to '1' bits. [D:/Projects/BConv/BConv.srcs/sources_1/new/delay.v:36]
WARNING: [Synth 8-3936] Found unconnected internal register 'A1_delay_1/buffer_reg[0]' and it is trimmed from '48' to '1' bits. [D:/Projects/BConv/BConv.srcs/sources_1/new/delay.v:36]
WARNING: [Synth 8-7129] Port replay_restart in module BConvEngine_8PE_V2 is either unconnected or has no load
WARNING: [Synth 8-3332] Sequential element (mux_lat_sel_reg[1]) is unused and will be removed from module RBU_V2.
WARNING: [Synth 8-3332] Sequential element (mux_lat_sel_reg[4]) is unused and will be removed from module RBU_V2.
---------------------------------------------------------------------------------
Finished Cross Boundary and Area Optimization : Time (s): cpu = 00:01:09 ; elapsed = 00:01:15 . Memory (MB): peak = 2745.852 ; gain = 790.777
---------------------------------------------------------------------------------
 Sort Area is RBU_V2 out_reg_8 : 0 0 : 2424 2424 : Used 8 time 100
 Sort Area is RBU_V2 out_reg_a : 0 0 : 2424 2424 : Used 8 time 100
 Sort Area is RBU_V2 out_reg_b : 0 0 : 2424 2424 : Used 8 time 100
 Sort Area is RBU_V2 pipe_w1/out_reg_13 : 0 0 : 2379 2379 : Used 8 time 100
 Sort Area is RBU_V2 pipe_w3/out_reg_15 : 0 0 : 2347 2347 : Used 8 time 100
 Sort Area is RBU_V2 pipe_w5/out_reg_17 : 0 0 : 2347 2347 : Used 8 time 100
 Sort Area is RBU_V2 pipe_z1/out_reg_12 : 0 0 : 2299 2299 : Used 8 time 100
 Sort Area is RBU_V2 pipe_z3/out_reg_f : 0 0 : 2299 2299 : Used 8 time 100
 Sort Area is RBU_V2 pipe_z5/out_reg_11 : 0 0 : 2299 2299 : Used 8 time 100
 Sort Area is RBU_V2 out_reg_4 : 0 0 : 2215 2215 : Used 8 time 100
 Sort Area is RBU_V2 out_reg_6 : 0 0 : 2215 2215 : Used 8 time 100
 Sort Area is RBU_V2 out_reg_7 : 0 0 : 2215 2215 : Used 8 time 100
 Sort Area is RBU_V2 out_reg_0 : 0 0 : 1978 1978 : Used 8 time 100
 Sort Area is RBU_V2 out_reg_2 : 0 0 : 1978 1978 : Used 8 time 100
 Sort Area is RBU_V2 out_reg_3 : 0 0 : 1978 1978 : Used 8 time 100
 Sort Area is RBU_V2 out_reg_c : 0 0 : 1978 1978 : Used 8 time 100
 Sort Area is RBU_V2 out_reg_d : 0 0 : 1978 1978 : Used 8 time 100
 Sort Area is RBU_V2 out_reg_e : 0 0 : 1978 1978 : Used 8 time 100
---------------------------------------------------------------------------------
Start ROM, RAM, DSP, Shift Register and Retiming Reporting
---------------------------------------------------------------------------------

DSP: Preliminary Mapping Report (see note below. The ' indicates corresponding REG is set)
+------------+---------------+--------+--------+--------+--------+--------+------+------+------+------+-------+------+------+
|Module Name | DSP Mapping   | A Size | B Size | C Size | D Size | P Size | AREG | BREG | CREG | DREG | ADREG | MREG | PREG | 
+------------+---------------+--------+--------+--------+--------+--------+------+------+------+------+-------+------+------+
|dsp_mul     | (A*B)'        | 16     | 16     | -      | -      | 32     | 0    | 0    | -    | -    | -     | 1    | 0    | 
|dsp_mul     | (A*B)'        | 16     | 16     | -      | -      | 32     | 0    | 0    | -    | -    | -     | 1    | 0    | 
|dsp_mul     | (A*B)'        | 16     | 16     | -      | -      | 32     | 0    | 0    | -    | -    | -     | 1    | 0    | 
|dsp_mul     | (A*B)'        | 17     | 17     | -      | -      | 34     | 0    | 0    | -    | -    | -     | 1    | 0    | 
|dsp_mul     | (A*B)'        | 17     | 17     | -      | -      | 34     | 0    | 0    | -    | -    | -     | 1    | 0    | 
|dsp_mul     | (A*B)'        | 17     | 17     | -      | -      | 34     | 0    | 0    | -    | -    | -     | 1    | 0    | 
|dsp_mul     | (C+A*B)'      | 18     | 17     | 35     | -      | 36     | 0    | 0    | 0    | -    | -     | 0    | 1    | 
|dsp_mul     | (C+A*B)'      | 18     | 17     | 35     | -      | 36     | 0    | 0    | 0    | -    | -     | 0    | 1    | 
|dsp_mul     | (C+A*B)'      | 18     | 17     | 35     | -      | 36     | 0    | 0    | 0    | -    | -     | 0    | 1    | 
|dsp_mul     | (A*B)'        | 16     | 16     | -      | -      | 32     | 0    | 0    | -    | -    | -     | 1    | 0    | 
|dsp_mul     | (A*B)'        | 16     | 16     | -      | -      | 32     | 0    | 0    | -    | -    | -     | 1    | 0    | 
|dsp_mul     | (A*B)'        | 16     | 16     | -      | -      | 32     | 0    | 0    | -    | -    | -     | 1    | 0    | 
|ModMul      | ((D+A)*B)'    | 16     | 17     | -      | 16     | 34     | 0    | 0    | -    | 0    | 0     | 1    | 1    | 
|ModMul      | ((D+A)*B)'    | 16     | 17     | -      | 16     | 34     | 0    | 0    | -    | 0    | 0     | 1    | 1    | 
|ModMul      | ((D+A)*B)'    | 16     | 17     | -      | 16     | 34     | 0    | 0    | -    | 0    | 0     | 1    | 1    | 
|ModMul      | ((D'+A'')*B)' | 16     | 17     | -      | 16     | 34     | 2    | 0    | -    | 1    | 0     | 1    | 1    | 
|ModMul      | ((D'+A'')*B)' | 16     | 17     | -      | 16     | 34     | 2    | 0    | -    | 1    | 0     | 1    | 1    | 
|ModMul      | ((D'+A'')*B)' | 16     | 17     | -      | 16     | 34     | 2    | 0    | -    | 1    | 0     | 1    | 1    | 
+------------+---------------+--------+--------+--------+--------+--------+------+------+------+------+-------+------+------+

Note: The table above is a preliminary report that shows the DSPs inferred at the current stage of the synthesis flow. Some DSP may be reimplemented as non DSP primitives later in the synthesis flow. Multiple instantiated DSPs are reported only once.
---------------------------------------------------------------------------------
Finished ROM, RAM, DSP, Shift Register and Retiming Reporting
---------------------------------------------------------------------------------
---------------------------------------------------------------------------------
Start Applying XDC Timing Constraints
---------------------------------------------------------------------------------
---------------------------------------------------------------------------------
Finished Applying XDC Timing Constraints : Time (s): cpu = 00:01:30 ; elapsed = 00:01:41 . Memory (MB): peak = 3047.516 ; gain = 1092.441
---------------------------------------------------------------------------------
---------------------------------------------------------------------------------
Start Timing Optimization
---------------------------------------------------------------------------------
---------------------------------------------------------------------------------
Finished Timing Optimization : Time (s): cpu = 00:01:39 ; elapsed = 00:01:49 . Memory (MB): peak = 3127.000 ; gain = 1171.926
---------------------------------------------------------------------------------
---------------------------------------------------------------------------------
Start Technology Mapping
---------------------------------------------------------------------------------
---------------------------------------------------------------------------------
Finished Technology Mapping : Time (s): cpu = 00:02:04 ; elapsed = 00:02:16 . Memory (MB): peak = 3243.793 ; gain = 1288.719
---------------------------------------------------------------------------------
---------------------------------------------------------------------------------
Start IO Insertion
---------------------------------------------------------------------------------
---------------------------------------------------------------------------------
Start Flattening Before IO Insertion
---------------------------------------------------------------------------------
---------------------------------------------------------------------------------
Finished Flattening Before IO Insertion
---------------------------------------------------------------------------------
---------------------------------------------------------------------------------
Start Final Netlist Cleanup
---------------------------------------------------------------------------------
---------------------------------------------------------------------------------
Finished Final Netlist Cleanup
---------------------------------------------------------------------------------
---------------------------------------------------------------------------------
Finished IO Insertion : Time (s): cpu = 00:02:12 ; elapsed = 00:02:24 . Memory (MB): peak = 3294.766 ; gain = 1339.691
---------------------------------------------------------------------------------
---------------------------------------------------------------------------------
Start Renaming Generated Instances
---------------------------------------------------------------------------------
---------------------------------------------------------------------------------
Finished Renaming Generated Instances : Time (s): cpu = 00:02:12 ; elapsed = 00:02:24 . Memory (MB): peak = 3294.766 ; gain = 1339.691
---------------------------------------------------------------------------------
---------------------------------------------------------------------------------
Start Rebuilding User Hierarchy
---------------------------------------------------------------------------------
---------------------------------------------------------------------------------
Finished Rebuilding User Hierarchy : Time (s): cpu = 00:02:27 ; elapsed = 00:02:39 . Memory (MB): peak = 3307.004 ; gain = 1351.930
---------------------------------------------------------------------------------
---------------------------------------------------------------------------------
Start Renaming Generated Ports
---------------------------------------------------------------------------------
---------------------------------------------------------------------------------
Finished Renaming Generated Ports : Time (s): cpu = 00:02:27 ; elapsed = 00:02:39 . Memory (MB): peak = 3307.004 ; gain = 1351.930
---------------------------------------------------------------------------------
---------------------------------------------------------------------------------
Start Handling Custom Attributes
---------------------------------------------------------------------------------
---------------------------------------------------------------------------------
Finished Handling Custom Attributes : Time (s): cpu = 00:02:28 ; elapsed = 00:02:40 . Memory (MB): peak = 3307.270 ; gain = 1352.195
---------------------------------------------------------------------------------
---------------------------------------------------------------------------------
Start Renaming Generated Nets
---------------------------------------------------------------------------------
---------------------------------------------------------------------------------
Finished Renaming Generated Nets : Time (s): cpu = 00:02:28 ; elapsed = 00:02:40 . Memory (MB): peak = 3307.270 ; gain = 1352.195
---------------------------------------------------------------------------------
---------------------------------------------------------------------------------
Start ROM, RAM, DSP, Shift Register and Retiming Reporting
---------------------------------------------------------------------------------

Static Shift Register Report:
+-------------------+----------------------------------------------------------------------+--------+-------+--------------+--------------------+-------------------+--------+---------+
|Module Name        | RTL Name                                                             | Length | Width | Reset Signal | Pull out first Reg | Pull out last Reg | SRL16E | SRLC32E | 
+-------------------+----------------------------------------------------------------------+--------+-------+--------------+--------------------+-------------------+--------+---------+
|BConvEngine_8PE_V2 | RBUA_unit/RBU_inst[0].RBU_i/ModMul_0/delay_q/buffer_reg[2][31]       | 3      | 256   | NO           | NO                 | YES               | 256    | 0       | 
|BConvEngine_8PE_V2 | RBUA_unit/RBU_inst[0].RBU_i/ModMul_0/delay_q/buffer_reg[3][47]       | 4      | 128   | NO           | NO                 | YES               | 128    | 0       | 
|BConvEngine_8PE_V2 | RBUA_unit/RBU_inst[0].RBU_i/ModMul_0/delay_q_final/buffer_reg[3][47] | 5      | 408   | NO           | NO                 | YES               | 408    | 0       | 
|BConvEngine_8PE_V2 | RBUA_unit/RBU_inst[0].RBU_i/ModMul_0/delay_z/buffer_reg[5][46]       | 6      | 256   | NO           | YES                | YES               | 256    | 0       | 
|BConvEngine_8PE_V2 | RBUA_unit/RBU_inst[0].RBU_i/ModMul_0/delay_z/buffer_reg[5][14]       | 6      | 120   | NO           | NO                 | YES               | 120    | 0       | 
|BConvEngine_8PE_V2 | RBUA_unit/RBU_inst[0].RBU_i/q_delay_3/buffer_reg[7][47]              | 9      | 384   | NO           | NO                 | YES               | 384    | 0       | 
|BConvEngine_8PE_V2 | RBUA_unit/RBU_inst[0].RBU_i/B0_DIV2_delay/buffer_reg[10][47]         | 11     | 720   | NO           | NO                 | YES               | 720    | 0       | 
|BConvEngine_8PE_V2 | RBUA_unit/RBU_inst[0].RBU_i/A1_delay_2/buffer_reg[12][47]            | 13     | 384   | NO           | NO                 | YES               | 384    | 0       | 
|BConvEngine_8PE_V2 | C_array2_delay/buffer_reg[3][47]                                     | 4      | 48    | NO           | NO                 | YES               | 48     | 0       | 
|BConvEngine_8PE_V2 | C_array3_delay/buffer_reg[5][47]                                     | 6      | 48    | NO           | NO                 | YES               | 48     | 0       | 
|BConvEngine_8PE_V2 | C_array4_delay/buffer_reg[7][47]                                     | 8      | 48    | NO           | NO                 | YES               | 48     | 0       | 
|BConvEngine_8PE_V2 | C_array5_delay/buffer_reg[9][47]                                     | 10     | 48    | NO           | NO                 | YES               | 48     | 0       | 
|BConvEngine_8PE_V2 | C_array6_delay/buffer_reg[11][47]                                    | 12     | 48    | NO           | NO                 | YES               | 48     | 0       | 
|BConvEngine_8PE_V2 | C_array7_delay/buffer_reg[13][47]                                    | 14     | 48    | NO           | NO                 | YES               | 48     | 0       | 
+-------------------+----------------------------------------------------------------------+--------+-------+--------------+--------------------+-------------------+--------+---------+

---------------------------------------------------------------------------------
Finished ROM, RAM, DSP, Shift Register and Retiming Reporting
---------------------------------------------------------------------------------
---------------------------------------------------------------------------------
Start Writing Synthesis Report
---------------------------------------------------------------------------------

DSP Final Report (the ' indicates corresponding REG is set)
+------------+----------------+--------+--------+--------+--------+--------+------+------+------+------+-------+------+------+
|Module Name | DSP Mapping    | A Size | B Size | C Size | D Size | P Size | AREG | BREG | CREG | DREG | ADREG | MREG | PREG | 
+------------+----------------+--------+--------+--------+--------+--------+------+------+------+------+-------+------+------+
|dsp_mul     | Dynamic        | -      | -      | -      | -      | 36     | -    | -    | -    | -    | -     | 0    | 1    | 
|dsp_mul     | Dynamic        | -      | -      | -      | -      | 36     | -    | -    | -    | -    | -     | 0    | 1    | 
|dsp_mul     | Dynamic        | -      | -      | -      | -      | 36     | -    | -    | -    | -    | -     | 0    | 1    | 
|dsp_mul     | (A'*B'')'      | 17     | 17     | -      | -      | 34     | 1    | 2    | -    | -    | -     | 0    | 1    | 
|dsp_mul     | (A'*B'')'      | 17     | 17     | -      | -      | 34     | 1    | 2    | -    | -    | -     | 0    | 1    | 
|dsp_mul     | (A'*B'')'      | 15     | 16     | -      | -      | 34     | 1    | 2    | -    | -    | -     | 0    | 1    | 
|dsp_mul     | ((A'*B'')')'   | 16     | 16     | -      | -      | 32     | 1    | 2    | -    | -    | -     | 1    | 1    | 
|dsp_mul     | ((A'*B'')')'   | 16     | 16     | -      | -      | 32     | 1    | 2    | -    | -    | -     | 1    | 1    | 
|dsp_mul     | ((A'*B'')')'   | 16     | 16     | -      | -      | 32     | 1    | 2    | -    | -    | -     | 1    | 1    | 
|dsp_mul     | ((A*B)')'      | 16     | 16     | -      | -      | 32     | 0    | 0    | -    | -    | -     | 1    | 1    | 
|dsp_mul     | ((A*B)')'      | 16     | 16     | -      | -      | 32     | 0    | 0    | -    | -    | -     | 1    | 1    | 
|dsp_mul     | ((A*B)')'      | 16     | 16     | -      | -      | 32     | 0    | 0    | -    | -    | -     | 1    | 1    | 
|ModMul      | ((D'+A''*B)')' | 16     | 17     | -      | 16     | 34     | 2    | 0    | -    | 0    | 0     | 1    | 1    | 
|ModMul      | ((D'+A''*B)')' | 16     | 17     | -      | 16     | 34     | 2    | 0    | -    | 0    | 0     | 1    | 1    | 
|ModMul      | ((D'+A''*B)')' | 16     | 17     | -      | 16     | 34     | 2    | 0    | -    | 0    | 0     | 1    | 1    | 
|ModMul      | ((D+A*B)')'    | 16     | 17     | -      | 16     | 34     | 0    | 0    | -    | 0    | 0     | 1    | 1    | 
|ModMul      | ((D+A*B)')'    | 16     | 17     | -      | 16     | 34     | 0    | 0    | -    | 0    | 0     | 1    | 1    | 
|ModMul      | ((D+A*B)')'    | 16     | 17     | -      | 16     | 34     | 0    | 0    | -    | 0    | 0     | 1    | 1    | 
|dsp_mul     | Dynamic        | -      | -      | -      | -      | 36     | -    | -    | -    | -    | -     | 0    | 1    | 
|dsp_mul     | Dynamic        | -      | -      | -      | -      | 36     | -    | -    | -    | -    | -     | 0    | 1    | 
|dsp_mul     | Dynamic        | -      | -      | -      | -      | 36     | -    | -    | -    | -    | -     | 0    | 1    | 
|dsp_mul     | (A'*B'')'      | 17     | 17     | -      | -      | 34     | 1    | 2    | -    | -    | -     | 0    | 1    | 
|dsp_mul     | (A'*B'')'      | 17     | 17     | -      | -      | 34     | 1    | 2    | -    | -    | -     | 0    | 1    | 
|dsp_mul     | (A'*B'')'      | 15     | 16     | -      | -      | 34     | 1    | 2    | -    | -    | -     | 0    | 1    | 
|dsp_mul     | ((A'*B'')')'   | 16     | 16     | -      | -      | 32     | 1    | 2    | -    | -    | -     | 1    | 1    | 
|dsp_mul     | ((A'*B'')')'   | 16     | 16     | -      | -      | 32     | 1    | 2    | -    | -    | -     | 1    | 1    | 
|dsp_mul     | ((A'*B'')')'   | 16     | 16     | -      | -      | 32     | 1    | 2    | -    | -    | -     | 1    | 1    | 
|dsp_mul     | ((A*B)')'      | 16     | 16     | -      | -      | 32     | 0    | 0    | -    | -    | -     | 1    | 1    | 
|dsp_mul     | ((A*B)')'      | 16     | 16     | -      | -      | 32     | 0    | 0    | -    | -    | -     | 1    | 1    | 
|dsp_mul     | ((A*B)')'      | 16     | 16     | -      | -      | 32     | 0    | 0    | -    | -    | -     | 1    | 1    | 
|ModMul      | ((D'+A''*B)')' | 16     | 17     | -      | 16     | 34     | 2    | 0    | -    | 0    | 0     | 1    | 1    | 
|ModMul      | ((D'+A''*B)')' | 16     | 17     | -      | 16     | 34     | 2    | 0    | -    | 0    | 0     | 1    | 1    | 
|ModMul      | ((D'+A''*B)')' | 16     | 17     | -      | 16     | 34     | 2    | 0    | -    | 0    | 0     | 1    | 1    | 
|ModMul      | ((D+A*B)')'    | 16     | 17     | -      | 16     | 34     | 0    | 0    | -    | 0    | 0     | 1    | 1    | 
|ModMul      | ((D+A*B)')'    | 16     | 17     | -      | 16     | 34     | 0    | 0    | -    | 0    | 0     | 1    | 1    | 
|ModMul      | ((D+A*B)')'    | 16     | 17     | -      | 16     | 34     | 0    | 0    | -    | 0    | 0     | 1    | 1    | 
|dsp_mul     | Dynamic        | -      | -      | -      | -      | 36     | -    | -    | -    | -    | -     | 0    | 1    | 
|dsp_mul     | Dynamic        | -      | -      | -      | -      | 36     | -    | -    | -    | -    | -     | 0    | 1    | 
|dsp_mul     | Dynamic        | -      | -      | -      | -      | 36     | -    | -    | -    | -    | -     | 0    | 1    | 
|dsp_mul     | (A'*B'')'      | 17     | 17     | -      | -      | 34     | 1    | 2    | -    | -    | -     | 0    | 1    | 
|dsp_mul     | (A'*B'')'      | 17     | 17     | -      | -      | 34     | 1    | 2    | -    | -    | -     | 0    | 1    | 
|dsp_mul     | (A'*B'')'      | 15     | 16     | -      | -      | 34     | 1    | 2    | -    | -    | -     | 0    | 1    | 
|dsp_mul     | ((A'*B'')')'   | 16     | 16     | -      | -      | 32     | 1    | 2    | -    | -    | -     | 1    | 1    | 
|dsp_mul     | ((A'*B'')')'   | 16     | 16     | -      | -      | 32     | 1    | 2    | -    | -    | -     | 1    | 1    | 
|dsp_mul     | ((A'*B'')')'   | 16     | 16     | -      | -      | 32     | 1    | 2    | -    | -    | -     | 1    | 1    | 
|dsp_mul     | ((A*B)')'      | 16     | 16     | -      | -      | 32     | 0    | 0    | -    | -    | -     | 1    | 1    | 
|dsp_mul     | ((A*B)')'      | 16     | 16     | -      | -      | 32     | 0    | 0    | -    | -    | -     | 1    | 1    | 
|dsp_mul     | ((A*B)')'      | 16     | 16     | -      | -      | 32     | 0    | 0    | -    | -    | -     | 1    | 1    | 
|ModMul      | ((D'+A''*B)')' | 16     | 17     | -      | 16     | 34     | 2    | 0    | -    | 0    | 0     | 1    | 1    | 
|ModMul      | ((D'+A''*B)')' | 16     | 17     | -      | 16     | 34     | 2    | 0    | -    | 0    | 0     | 1    | 1    | 
|ModMul      | ((D'+A''*B)')' | 16     | 17     | -      | 16     | 34     | 2    | 0    | -    | 0    | 0     | 1    | 1    | 
|ModMul      | ((D+A*B)')'    | 16     | 17     | -      | 16     | 34     | 0    | 0    | -    | 0    | 0     | 1    | 1    | 
|ModMul      | ((D+A*B)')'    | 16     | 17     | -      | 16     | 34     | 0    | 0    | -    | 0    | 0     | 1    | 1    | 
|ModMul      | ((D+A*B)')'    | 16     | 17     | -      | 16     | 34     | 0    | 0    | -    | 0    | 0     | 1    | 1    | 
|dsp_mul     | Dynamic        | -      | -      | -      | -      | 36     | -    | -    | -    | -    | -     | 0    | 1    | 
|dsp_mul     | Dynamic        | -      | -      | -      | -      | 36     | -    | -    | -    | -    | -     | 0    | 1    | 
|dsp_mul     | Dynamic        | -      | -      | -      | -      | 36     | -    | -    | -    | -    | -     | 0    | 1    | 
|dsp_mul     | (A'*B'')'      | 17     | 17     | -      | -      | 34     | 1    | 2    | -    | -    | -     | 0    | 1    | 
|dsp_mul     | (A'*B'')'      | 17     | 17     | -      | -      | 34     | 1    | 2    | -    | -    | -     | 0    | 1    | 
|dsp_mul     | (A'*B'')'      | 15     | 16     | -      | -      | 34     | 1    | 2    | -    | -    | -     | 0    | 1    | 
|dsp_mul     | ((A'*B'')')'   | 16     | 16     | -      | -      | 32     | 1    | 2    | -    | -    | -     | 1    | 1    | 
|dsp_mul     | ((A'*B'')')'   | 16     | 16     | -      | -      | 32     | 1    | 2    | -    | -    | -     | 1    | 1    | 
|dsp_mul     | ((A'*B'')')'   | 16     | 16     | -      | -      | 32     | 1    | 2    | -    | -    | -     | 1    | 1    | 
|dsp_mul     | ((A*B)')'      | 16     | 16     | -      | -      | 32     | 0    | 0    | -    | -    | -     | 1    | 1    | 
|dsp_mul     | ((A*B)')'      | 16     | 16     | -      | -      | 32     | 0    | 0    | -    | -    | -     | 1    | 1    | 
|dsp_mul     | ((A*B)')'      | 16     | 16     | -      | -      | 32     | 0    | 0    | -    | -    | -     | 1    | 1    | 
|ModMul      | ((D'+A''*B)')' | 16     | 17     | -      | 16     | 34     | 2    | 0    | -    | 0    | 0     | 1    | 1    | 
|ModMul      | ((D'+A''*B)')' | 16     | 17     | -      | 16     | 34     | 2    | 0    | -    | 0    | 0     | 1    | 1    | 
|ModMul      | ((D'+A''*B)')' | 16     | 17     | -      | 16     | 34     | 2    | 0    | -    | 0    | 0     | 1    | 1    | 
|ModMul      | ((D+A*B)')'    | 16     | 17     | -      | 16     | 34     | 0    | 0    | -    | 0    | 0     | 1    | 1    | 
|ModMul      | ((D+A*B)')'    | 16     | 17     | -      | 16     | 34     | 0    | 0    | -    | 0    | 0     | 1    | 1    | 
|ModMul      | ((D+A*B)')'    | 16     | 17     | -      | 16     | 34     | 0    | 0    | -    | 0    | 0     | 1    | 1    | 
|dsp_mul     | Dynamic        | -      | -      | -      | -      | 36     | -    | -    | -    | -    | -     | 0    | 1    | 
|dsp_mul     | Dynamic        | -      | -      | -      | -      | 36     | -    | -    | -    | -    | -     | 0    | 1    | 
|dsp_mul     | Dynamic        | -      | -      | -      | -      | 36     | -    | -    | -    | -    | -     | 0    | 1    | 
|dsp_mul     | (A'*B'')'      | 17     | 17     | -      | -      | 34     | 1    | 2    | -    | -    | -     | 0    | 1    | 
|dsp_mul     | (A'*B'')'      | 17     | 17     | -      | -      | 34     | 1    | 2    | -    | -    | -     | 0    | 1    | 
|dsp_mul     | (A'*B'')'      | 15     | 16     | -      | -      | 34     | 1    | 2    | -    | -    | -     | 0    | 1    | 
|dsp_mul     | ((A'*B'')')'   | 16     | 16     | -      | -      | 32     | 1    | 2    | -    | -    | -     | 1    | 1    | 
|dsp_mul     | ((A'*B'')')'   | 16     | 16     | -      | -      | 32     | 1    | 2    | -    | -    | -     | 1    | 1    | 
|dsp_mul     | ((A'*B'')')'   | 16     | 16     | -      | -      | 32     | 1    | 2    | -    | -    | -     | 1    | 1    | 
|dsp_mul     | ((A*B)')'      | 16     | 16     | -      | -      | 32     | 0    | 0    | -    | -    | -     | 1    | 1    | 
|dsp_mul     | ((A*B)')'      | 16     | 16     | -      | -      | 32     | 0    | 0    | -    | -    | -     | 1    | 1    | 
|dsp_mul     | ((A*B)')'      | 16     | 16     | -      | -      | 32     | 0    | 0    | -    | -    | -     | 1    | 1    | 
|ModMul      | ((D'+A''*B)')' | 16     | 17     | -      | 16     | 34     | 2    | 0    | -    | 0    | 0     | 1    | 1    | 
|ModMul      | ((D'+A''*B)')' | 16     | 17     | -      | 16     | 34     | 2    | 0    | -    | 0    | 0     | 1    | 1    | 
|ModMul      | ((D'+A''*B)')' | 16     | 17     | -      | 16     | 34     | 2    | 0    | -    | 0    | 0     | 1    | 1    | 
|ModMul      | ((D+A*B)')'    | 16     | 17     | -      | 16     | 34     | 0    | 0    | -    | 0    | 0     | 1    | 1    | 
|ModMul      | ((D+A*B)')'    | 16     | 17     | -      | 16     | 34     | 0    | 0    | -    | 0    | 0     | 1    | 1    | 
|ModMul      | ((D+A*B)')'    | 16     | 17     | -      | 16     | 34     | 0    | 0    | -    | 0    | 0     | 1    | 1    | 
|dsp_mul     | Dynamic        | -      | -      | -      | -      | 36     | -    | -    | -    | -    | -     | 0    | 1    | 
|dsp_mul     | Dynamic        | -      | -      | -      | -      | 36     | -    | -    | -    | -    | -     | 0    | 1    | 
|dsp_mul     | Dynamic        | -      | -      | -      | -      | 36     | -    | -    | -    | -    | -     | 0    | 1    | 
|dsp_mul     | (A'*B'')'      | 17     | 17     | -      | -      | 34     | 1    | 2    | -    | -    | -     | 0    | 1    | 
|dsp_mul     | (A'*B'')'      | 17     | 17     | -      | -      | 34     | 1    | 2    | -    | -    | -     | 0    | 1    | 
|dsp_mul     | (A'*B'')'      | 15     | 16     | -      | -      | 34     | 1    | 2    | -    | -    | -     | 0    | 1    | 
|dsp_mul     | ((A'*B'')')'   | 16     | 16     | -      | -      | 32     | 1    | 2    | -    | -    | -     | 1    | 1    | 
|dsp_mul     | ((A'*B'')')'   | 16     | 16     | -      | -      | 32     | 1    | 2    | -    | -    | -     | 1    | 1    | 
|dsp_mul     | ((A'*B'')')'   | 16     | 16     | -      | -      | 32     | 1    | 2    | -    | -    | -     | 1    | 1    | 
|dsp_mul     | ((A*B)')'      | 16     | 16     | -      | -      | 32     | 0    | 0    | -    | -    | -     | 1    | 1    | 
|dsp_mul     | ((A*B)')'      | 16     | 16     | -      | -      | 32     | 0    | 0    | -    | -    | -     | 1    | 1    | 
|dsp_mul     | ((A*B)')'      | 16     | 16     | -      | -      | 32     | 0    | 0    | -    | -    | -     | 1    | 1    | 
|ModMul      | ((D'+A''*B)')' | 16     | 17     | -      | 16     | 34     | 2    | 0    | -    | 0    | 0     | 1    | 1    | 
|ModMul      | ((D'+A''*B)')' | 16     | 17     | -      | 16     | 34     | 2    | 0    | -    | 0    | 0     | 1    | 1    | 
|ModMul      | ((D'+A''*B)')' | 16     | 17     | -      | 16     | 34     | 2    | 0    | -    | 0    | 0     | 1    | 1    | 
|ModMul      | ((D+A*B)')'    | 16     | 17     | -      | 16     | 34     | 0    | 0    | -    | 0    | 0     | 1    | 1    | 
|ModMul      | ((D+A*B)')'    | 16     | 17     | -      | 16     | 34     | 0    | 0    | -    | 0    | 0     | 1    | 1    | 
|ModMul      | ((D+A*B)')'    | 16     | 17     | -      | 16     | 34     | 0    | 0    | -    | 0    | 0     | 1    | 1    | 
|dsp_mul     | Dynamic        | -      | -      | -      | -      | 36     | -    | -    | -    | -    | -     | 0    | 1    | 
|dsp_mul     | Dynamic        | -      | -      | -      | -      | 36     | -    | -    | -    | -    | -     | 0    | 1    | 
|dsp_mul     | Dynamic        | -      | -      | -      | -      | 36     | -    | -    | -    | -    | -     | 0    | 1    | 
|dsp_mul     | (A'*B'')'      | 17     | 17     | -      | -      | 34     | 1    | 2    | -    | -    | -     | 0    | 1    | 
|dsp_mul     | (A'*B'')'      | 17     | 17     | -      | -      | 34     | 1    | 2    | -    | -    | -     | 0    | 1    | 
|dsp_mul     | (A'*B'')'      | 15     | 16     | -      | -      | 34     | 1    | 2    | -    | -    | -     | 0    | 1    | 
|dsp_mul     | ((A'*B'')')'   | 16     | 16     | -      | -      | 32     | 1    | 2    | -    | -    | -     | 1    | 1    | 
|dsp_mul     | ((A'*B'')')'   | 16     | 16     | -      | -      | 32     | 1    | 2    | -    | -    | -     | 1    | 1    | 
|dsp_mul     | ((A'*B'')')'   | 16     | 16     | -      | -      | 32     | 1    | 2    | -    | -    | -     | 1    | 1    | 
|dsp_mul     | ((A*B)')'      | 16     | 16     | -      | -      | 32     | 0    | 0    | -    | -    | -     | 1    | 1    | 
|dsp_mul     | ((A*B)')'      | 16     | 16     | -      | -      | 32     | 0    | 0    | -    | -    | -     | 1    | 1    | 
|dsp_mul     | ((A*B)')'      | 16     | 16     | -      | -      | 32     | 0    | 0    | -    | -    | -     | 1    | 1    | 
|ModMul      | ((D'+A''*B)')' | 16     | 17     | -      | 16     | 34     | 2    | 0    | -    | 0    | 0     | 1    | 1    | 
|ModMul      | ((D'+A''*B)')' | 16     | 17     | -      | 16     | 34     | 2    | 0    | -    | 0    | 0     | 1    | 1    | 
|ModMul      | ((D'+A''*B)')' | 16     | 17     | -      | 16     | 34     | 2    | 0    | -    | 0    | 0     | 1    | 1    | 
|ModMul      | ((D+A*B)')'    | 16     | 17     | -      | 16     | 34     | 0    | 0    | -    | 0    | 0     | 1    | 1    | 
|ModMul      | ((D+A*B)')'    | 16     | 17     | -      | 16     | 34     | 0    | 0    | -    | 0    | 0     | 1    | 1    | 
|ModMul      | ((D+A*B)')'    | 16     | 17     | -      | 16     | 34     | 0    | 0    | -    | 0    | 0     | 1    | 1    | 
|dsp_mul     | Dynamic        | -      | -      | -      | -      | 36     | -    | -    | -    | -    | -     | 0    | 1    | 
|dsp_mul     | Dynamic        | -      | -      | -      | -      | 36     | -    | -    | -    | -    | -     | 0    | 1    | 
|dsp_mul     | Dynamic        | -      | -      | -      | -      | 36     | -    | -    | -    | -    | -     | 0    | 1    | 
|dsp_mul     | (A'*B'')'      | 17     | 17     | -      | -      | 34     | 1    | 2    | -    | -    | -     | 0    | 1    | 
|dsp_mul     | (A'*B'')'      | 17     | 17     | -      | -      | 34     | 1    | 2    | -    | -    | -     | 0    | 1    | 
|dsp_mul     | (A'*B'')'      | 15     | 16     | -      | -      | 34     | 1    | 2    | -    | -    | -     | 0    | 1    | 
|dsp_mul     | ((A'*B'')')'   | 16     | 16     | -      | -      | 32     | 1    | 2    | -    | -    | -     | 1    | 1    | 
|dsp_mul     | ((A'*B'')')'   | 16     | 16     | -      | -      | 32     | 1    | 2    | -    | -    | -     | 1    | 1    | 
|dsp_mul     | ((A'*B'')')'   | 16     | 16     | -      | -      | 32     | 1    | 2    | -    | -    | -     | 1    | 1    | 
|dsp_mul     | ((A*B)')'      | 16     | 16     | -      | -      | 32     | 0    | 0    | -    | -    | -     | 1    | 1    | 
|dsp_mul     | ((A*B)')'      | 16     | 16     | -      | -      | 32     | 0    | 0    | -    | -    | -     | 1    | 1    | 
|dsp_mul     | ((A*B)')'      | 16     | 16     | -      | -      | 32     | 0    | 0    | -    | -    | -     | 1    | 1    | 
|ModMul      | ((D'+A''*B)')' | 16     | 17     | -      | 16     | 34     | 2    | 0    | -    | 0    | 0     | 1    | 1    | 
|ModMul      | ((D'+A''*B)')' | 16     | 17     | -      | 16     | 34     | 2    | 0    | -    | 0    | 0     | 1    | 1    | 
|ModMul      | ((D'+A''*B)')' | 16     | 17     | -      | 16     | 34     | 2    | 0    | -    | 0    | 0     | 1    | 1    | 
|ModMul      | ((D+A*B)')'    | 16     | 17     | -      | 16     | 34     | 0    | 0    | -    | 0    | 0     | 1    | 1    | 
|ModMul      | ((D+A*B)')'    | 16     | 17     | -      | 16     | 34     | 0    | 0    | -    | 0    | 0     | 1    | 1    | 
|ModMul      | ((D+A*B)')'    | 16     | 17     | -      | 16     | 34     | 0    | 0    | -    | 0    | 0     | 1    | 1    | 
+------------+----------------+--------+--------+--------+--------+--------+------+------+------+------+-------+------+------+


Report BlackBoxes: 
+-+--------------+----------+
| |BlackBox name |Instances |
+-+--------------+----------+
+-+--------------+----------+

Report Cell Usage: 
+------+----------------+------+
|      |Cell            |Count |
+------+----------------+------+
|1     |CARRY8          |  1383|
|2     |DSP_ALU         |   144|
|4     |DSP_A_B_DATA    |   144|
|7     |DSP_C_DATA      |   144|
|9     |DSP_MULTIPLIER  |   144|
|11    |DSP_M_DATA      |   144|
|13    |DSP_OUTPUT      |   144|
|14    |DSP_PREADD      |   144|
|15    |DSP_PREADD_DATA |   144|
|18    |LUT1            |    73|
|19    |LUT2            |  4316|
|20    |LUT3            |  6427|
|21    |LUT4            |  4520|
|22    |LUT5            |  2944|
|23    |LUT6            |  1496|
|24    |SRL16E          |  2944|
|25    |FDCE            |  3812|
|26    |FDRE            | 13350|
|27    |LD              |    23|
+------+----------------+------+
---------------------------------------------------------------------------------
Finished Writing Synthesis Report : Time (s): cpu = 00:02:29 ; elapsed = 00:02:41 . Memory (MB): peak = 3307.531 ; gain = 1352.457
---------------------------------------------------------------------------------
Synthesis finished with 0 errors, 0 critical warnings and 16 warnings.
Synthesis Optimization Runtime : Time (s): cpu = 00:01:53 ; elapsed = 00:02:17 . Memory (MB): peak = 3307.578 ; gain = 1112.992
Synthesis Optimization Complete : Time (s): cpu = 00:02:29 ; elapsed = 00:02:41 . Memory (MB): peak = 3307.578 ; gain = 1352.504
INFO: [Project 1-571] Translating synthesized netlist
Netlist sorting complete. Time (s): cpu = 00:00:01 ; elapsed = 00:00:00.915 . Memory (MB): peak = 3344.418 ; gain = 0.000
INFO: [Netlist 29-17] Analyzing 1550 Unisim elements for replacement
INFO: [Netlist 29-28] Unisim Transformation completed in 2 CPU seconds
INFO: [Project 1-570] Preparing netlist for logic optimization
INFO: [Opt 31-138] Pushed 0 inverter(s) to 0 load pin(s).
Netlist sorting complete. Time (s): cpu = 00:00:00 ; elapsed = 00:00:00.013 . Memory (MB): peak = 3530.484 ; gain = 0.000
INFO: [Project 1-111] Unisim Transformation Summary:
  A total of 167 instances were transformed.
  DSP48E2 => DSP48E2 (DSP_ALU, DSP_A_B_DATA, DSP_C_DATA, DSP_MULTIPLIER, DSP_M_DATA, DSP_OUTPUT, DSP_PREADD, DSP_PREADD_DATA): 144 instances
  LD => LDCE: 23 instances

The system cannot find the path specified.
Synth Design complete | Checksum: c4ccec5b
INFO: [Common 17-83] Releasing license: Synthesis
95 Infos, 27 Warnings, 0 Critical Warnings and 0 Errors encountered.
synth_design completed successfully
synth_design: Time (s): cpu = 00:03:02 ; elapsed = 00:03:33 . Memory (MB): peak = 3530.484 ; gain = 3038.516
Write ShapeDB Complete: Time (s): cpu = 00:00:00 ; elapsed = 00:00:00.157 . Memory (MB): peak = 3530.484 ; gain = 0.000
INFO: [Common 17-1381] The checkpoint 'D:/Projects/BConv/BConv.runs/synth_1/BConvEngine_8PE_V2.dcp' has been generated.
write_checkpoint: Time (s): cpu = 00:00:07 ; elapsed = 00:00:05 . Memory (MB): peak = 3530.484 ; gain = 0.000
INFO: [runtcl-4] Executing : report_utilization -file BConvEngine_8PE_V2_utilization_synth.rpt -pb BConvEngine_8PE_V2_utilization_synth.pb
INFO: [Common 17-206] Exiting Vivado at Mon Dec 22 14:29:04 2025...
